{
  "test_decks": {
    "empty_deck": {
      "name": "Empty Deck",
      "cards": []
    },
    "latin": {
      "name": "Latin Literature",
      "cards": [
        {
          "question": "Who was Virgil?",
          "answer": "A Roman poet known for the 'Aeneid'",
          "flag": "None",
          "cardState": "New"
        },
        {
          "question": "What is the 'Aeneid'?",
          "answer": "An epic poem about Aeneas's journey",
          "flag": "None",
          "cardState": "New"
        },
        {
          "question": "Who was Horace?",
          "answer": "A leading Roman lyric poet",
          "flag": "None",
          "cardState": "New"
        },
        {
          "question": "What type of work is 'Satires' by Horace?",
          "answer": "A collection of satirical poems",
          "flag": "None",
          "cardState": "New"
        },
        {
          "question": "Who was Ovid?",
          "answer": "A Roman poet famous for 'Metamorphoses'",
          "flag": "None",
          "cardState": "New"
        },
        {
          "question": "What is 'Metamorphoses'?",
          "answer": "A narrative poem of mythological transformations",
          "flag": "None",
          "cardState": "New"
        },
        {
          "question": "Who was Cicero?",
          "answer": "A Roman statesman and orator",
          "flag": "None",
          "cardState": "New"
        },
        {
          "question": "What was Cicero's literary style known for?",
          "answer": "Its eloquence and rhetorical skill",
          "flag": "None",
          "cardState": "New"
        },
        {
          "question": "Who was Catullus?",
          "answer": "A Roman poet known for personal poetry",
          "flag": "None",
          "cardState": "New"
        },
        {
          "question": "What is 'Carmina' by Catullus?",
          "answer": "A collection of short poetic works",
          "flag": "None",
          "cardState": "New"
        },
        {
          "question": "How does Virgil portray Aeneas\\' internal conflict between duty and personal desire\\?",
          "answer": "Focus on 'pietas\\' and Aeneas\\' moral struggle.",
          "flag": "None",
          "cardState": "New"
        },
        {
          "question": "What is the significance of the Trojan Horse story in highlighting Greek cunning\\?",
          "answer": "Emphasizes deceit vs. Trojan trust.",
          "flag": "None",
          "cardState": "New"
        },
        {
          "question": "How do the gods\\' interventions affect Aeneas\\' journey\\?",
          "answer": "Divine forces shape his fate and trials.",
          "flag": "None",
          "cardState": "New"
        },
        {
          "question": "How is the concept of 'pietas\\' central to Aeneas\\' decisions\\?",
          "answer": "Reflects duty to family, gods, and destiny.",
          "flag": "None",
          "cardState": "New"
        },
        {
          "question": "What role does Dido\\'s tragic story play in exploring the cost of fate\\?",
          "answer": "Her downfall highlights sacrifices for Rome.",
          "flag": "None",
          "cardState": "New"
        },
        {
          "question": "How does Book VI of the Aeneid foreshadow future events through the Underworld visit\\?",
          "answer": "Encounters with shades predict key outcomes.",
          "flag": "None",
          "cardState": "New"
        },
        {
          "question": "In what ways does Virgil utilize epic similes to add depth to the narrative\\?",
          "answer": "Similes enhance tension and highlight heroism.",
          "flag": "None",
          "cardState": "New"
        },
        {
          "question": "What is the political undertone of the Aeneid regarding Roman origins\\?",
          "answer": "Justifies Augustan rule and Roman identity.",
          "flag": "None",
          "cardState": "New"
        },
        {
          "question": "How does Juno\\'s opposition reflect divine conflicts influencing the plot of the Aeneid\\?",
          "answer": "Shows competing wills of gods vs. fate.",
          "flag": "None",
          "cardState": "New"
        },
        {
          "question": "Why is prophecy crucial in guiding Aeneas\\' actions and resolve\\?",
          "answer": "Prophecies ensure he aligns with destiny.",
          "flag": "None",
          "cardState": "New"
        },
        {
          "question": "How does the overarching theme of transformation in 'Metamorphoses\\' symbolize life\\'s instability\\?",
          "answer": "Shifts in form mirror human vulnerabilities.",
          "flag": "None",
          "cardState": "New"
        },
        {
          "question": "What does Apollo and Daphne\\'s myth reveal about boundaries between pursuit and violation\\?",
          "answer": "Explores unrequited desire and forced change.",
          "flag": "None",
          "cardState": "New"
        },
        {
          "question": "How does transformation serve as a form of divine punishment in Ovid\\'s work\\?",
          "answer": "Reveals gods\\' quickness to impose extreme fates.",
          "flag": "None",
          "cardState": "New"
        },
        {
          "question": "How are the various myths connected by frame narratives throughout 'Metamorphoses\\'\\?",
          "answer": "Stories transition smoothly via thematic links.",
          "flag": "None",
          "cardState": "New"
        },
        {
          "question": "What does Pygmalion\\'s tale suggest about creative power and reality\\?",
          "answer": "Blurs line between artistic vision and life.",
          "flag": "None",
          "cardState": "New"
        },
        {
          "question": "How does Ovid portray the gods\\' cruelty in stories like Io\\'s transformation\\?",
          "answer": "Emphasizes instability of mortal life under divine whim.",
          "flag": "None",
          "cardState": "New"
        },
        {
          "question": "In what ways does Ovid use vivid imagery to convey the sensual aspects of metamorphosis\\?",
          "answer": "Graphic details highlight physical and emotional chaos.",
          "flag": "None",
          "cardState": "New"
        },
        {
          "question": "What commentary on gender dynamics emerges in tales like Procne and Philomela\\?",
          "answer": "Examines trauma, power imbalances, and retaliation.",
          "flag": "None",
          "cardState": "New"
        },
        {
          "question": "Why is the final transformation in Book XV of Metamorphoses significant to the poem\\'s theme of change\\?",
          "answer": "Cements the perpetual cycle of creation and renewal.",
          "flag": "None",
          "cardState": "New"
        },
        {
          "question": "How do these transformations reflect Ovid\\'s view on divine justice\\?",
          "answer": "Punishments and rewards reveal divine arbitrariness.",
          "flag": "None",
          "cardState": "New"
        }
      ]
    },
    "java": {
      "name": "Java Programming",
      "cards": [
        {
          "question": "What is the purpose of the 'main' method in Java?",
          "answer": "It's the entry point to start program execution.",
          "flag": "None",
          "cardState": "New"
        },
        {
          "question": "How do you declare a variable in Java?",
          "answer": "Specify type, then variable name, e.g. int x;",
          "flag": "None",
          "cardState": "New"
        },
        {
          "question": "What is a class in Java?",
          "answer": "A blueprint for creating objects.",
          "flag": "None",
          "cardState": "New"
        },
        {
          "question": "What does 'public' mean in a method declaration?",
          "answer": "It means the method is accessible from other classes.",
          "flag": "None",
          "cardState": "New"
        },
        {
          "question": "What is the difference between '==' and 'equals()' in Java?",
          "answer": "'==' compares references; 'equals()' compares values.",
          "flag": "None",
          "cardState": "New"
        },
        {
          "question": "What is a constructor?",
          "answer": "A special method used to create and initialize objects.",
          "flag": "None",
          "cardState": "New"
        },
        {
          "question": "What is method overloading?",
          "answer": "Having methods with the same name but different parameter lists.",
          "flag": "None",
          "cardState": "New"
        },
        {
          "question": "What is method overriding?",
          "answer": "Redefining a parent class method in a subclass.",
          "flag": "None",
          "cardState": "New"
        },
        {
          "question": "What is 'static' in Java?",
          "answer": "Belongs to the class rather than instances of it.",
          "flag": "None",
          "cardState": "New"
        },
        {
          "question": "What is the role of the 'this' keyword in Java?",
          "answer": "Refers to the current object instance.",
          "flag": "None",
          "cardState": "New"
        },
        {
          "question": "What is the difference between 'int' and 'Integer'?",
          "answer": "'int' is a primitive type; 'Integer' is an object wrapper.",
          "flag": "None",
          "cardState": "New"
        },
        {
          "question": "What does 'final' do when used on a variable?",
          "answer": "Prevents the variable's value from changing once assigned.",
          "flag": "None",
          "cardState": "New"
        },
        {
          "question": "How do you comment a single line in Java?",
          "answer": "Use `//` at the beginning of the comment.",
          "flag": "None",
          "cardState": "New"
        },
        {